,,Feature group catalog (column-level),,,,Feature groups registered for 22 column(s); catalog written to feature_groups_2_1_5.csv.,,,,feature_groups_2_1_5.csv,feature_groups_2_1_5.json,feature_groups_2_1_5.yaml,,,,,"{""categorical_low_card"": 15, ""id"": 1, ""numeric_continuous"": 3, ""numeric_flag"": 1, ""target"": 1, ""target_aux"": 1}",,,info,,,,,,,,,,,,,,,,,,,,,,,,,,,,,,,,,,,,,,,,,,,22.0,,,,,,,,,,,,,,,,,,,,,,,,,,,,,,,,,,,,,,,4.0,,,,,,,,,,,,0.0,,,,,,,,,,,,2.1.5,Feature group registration,,OK,,,,2025-12-05 09:23:53.180598,,,,,
,,Feature space config (groups → columns),,,,"Feature space scaffolding built from feature_groups_2_1_5.csv; JSON: feature_space_2_1_6.json, YAML: feature_space_2_1_6.yaml.",,,,,,,feature_space_2_1_6.json,feature_space_2_1_6.yaml,,,"{""categorical_low_card"": 15, ""id"": 1, ""numeric_continuous"": 3, ""numeric_flag"": 1, ""target"": 1, ""target_aux"": 1}",,,info,,,,,,,,,,,,,,,,,,,,,,,,,,,,,,,,,,,,,,,,,,,22.0,,,,,6.0,,,,,,,,,,,,,,,,,,,,,,,,,,,,,,,,,,4.0,,,,,,,,,,,,,,,,,,,,,,,,2.1.6,Feature space scaffolding,feature_groups_2_1_5.csv,OK,,,,2025-12-05 09:23:53.290397,,,,,
,,Schema-driven dtype alignment (read-only),,,,Baseline: dtype_baseline_report.csv; Enforcement: dtype_enforcement_report.csv,,,,,,,,,,,,,,info,,,,,,,,,,,,,,,,,,,,,,,0.0,,,,,,,,,,,,,,,,,,,,,,,,,,,,,,,,,,,,,,,,0.0,,,,,,,,,,,,,,,,,,,,,,,,,,,,,,,,,,,,,,,,,,,2.1.7A,Column-type alignment audit (no coercion),,SKIP,,,,2025-12-05 09:23:53.422092,,,,,
,,Apply SCHEMA_EXPECTED_DTYPES to df (mutable),,,,Coercion skipped or no applicable columns.,,,,,,,,,,,,,,info,,,,,,,,,,,,,,,,,,,,,,,,0.0,,,,,,,,,,,,,,,,,,,,,,,,,,,,,,,,,,,,,,,,,,,,,,,,,,,,,,,,,,,,,,,,,,,,,,,,,,,,,,,,,,2.1.7.5,Optional dtype coercion apply phase,,SKIP,,,,2025-12-05 09:23:53.575331,,,,,
,,Compare df columns to EXPECTED_SCHEMA_COLUMNS / SCHEMA_EXPECTED_DTYPES,,,,Column comparison: schema_column_comparison.csv; Drift summary: schema_drift_report.csv,,,,,,,,,,,,,,info,,,,,,22.0,,,,,,,,,,,,,,,,,,,,,,,,,,,,,,,,,,0.0,,,,,,,,,,,,,,,,,,,,,,,,0.0,,,,,,,,,,,,,,,,,,,,,0.0,,,,,,,,,,22.0,,,,,,,,,,,2.1.6,Structural drift detection & expected schema comparison,,SKIP,,,,2025-12-05 09:23:53.658248,,,,,
,,Feature roles & groups catalog,,,,Roles: feature_roles.csv; Groups YAML: feature_groups_2_1_7.yaml,,,,,,,,,,,,,,info,,,,,,,,,,,,,,,,,,,,,,22.0,,,,,,,,,,,,,,,,,,,,6.0,,,,,,,,,,,,,,,,,,,,,,,,,,,,,,,,,,,,,,,,3.0,,,,,,,,,,,,0.0,,,,,,,,,,,,2.1.7,Column role classification & feature group registration,,OK,,,,2025-12-05 09:23:53.779301,,,,,
,,Column-level missingness baseline,,,,Missingness baseline: missingness_baseline.csv,,,,,,,,,,,,,,info,,0.1562,TotalCharges,,,,,,,,,,,,,,,,,,,,,,,,,,,,,,,,,,,,,,,,,,,,,,,,,,,,,,,,,,,,,,,,,,,,,,,,,,,,,,,,,,,,,,,,,,,,,,,,,,,0.0071,,,,2.1.8,Missingness baseline (pre-coercion),,OK,,,,2025-12-05 09:23:54.038594,,,,,
,,Binary vs continuous numeric classification,,,,Audit written to binary_continuous_audit.csv,,,,,,,,,,,,,,info,,,,,,,,,,,,,,,,2.0,,,,,,,,,,,,,,3.0,,,,,,,,,,,,,,,,,,,,,,,,,,,,,,,,,,,,,,,,,5.0,,,,,,,,,,,,,,,,,,,,,,,,,,,,,,,,,,,2.1.9,Binary vs continuous feature audit,,OK,,,,2025-12-05 09:23:54.113024,,,,,
,,Per-column cardinality overview,,,,Cardinality summary written to feature_cardinality_summary.csv,,,,,,,,,,,,,,info,7043.0,,,,,,,,,,,,,,,,,,,,,22.0,,,,,,,0.0,,,,,,,,,,,,,,,,,,,,,,2.0,,,,,,,,,,,,,,,,,,,,,,,,,,,,,,,,,,,,,,,,,,,,,,,,,,,,,,,2.1.10,Feature cardinality summary,,OK,,,,2025-12-05 09:23:54.238691,,,,,
,,Merged schema consistency snapshot,,,,Schema consistency report written to schema_consistency_report.csv,,,,,,,,,,,,,,info,,,,,,,,,,,,,,,,,,,,,,22.0,,,,,,,,,,,,,,,,,,,,,,,,,,,,,,,,,,,,,,,,,,,,,,,,,,,,,,,,,,,,,,,,,,,,,,,,,,,,,,,,,,,,2.1.11,Structural summary report (Section 2.1),,OK,,,,2025-12-05 09:23:54.338225,,,,,
,,Column type detection summary & type map artifact,,,,Type map → column_type_map.json; summary → type_detection_summary.csv,,,,,,,,,,,,,,info,,,,,,,,,,,,,,,,,5.0,,,12.0,,22.0,,,,,,,,,,,,,,0.0,,,,,,,,,,,,,,,,,,,,,,,,,,,,,,,,,,5.0,,,,,,,,,,,,,,,,,,,,,,,,,,,,,,,,,,,,2.2.1,Auto-detect data types,,OK,,,,2025-12-05 17:23:54.925263+00:00,,,,,
0.0,,Coerce numeric/datetime-like strings with audit log,,,,Coercion log → coercion_log.csv; df mutated only when APPLY_COERCION=True & success is high,,,,,,,,,,,,,,info,,,,,,,,,0.0,,,0.0,,,,,,,,,,22.0,,,,,,,,,,,,,,,,,,,0.0,,,,,,,,,,,,,,,,,,,,,,,,,,,,,,,,,,,,,,,,,,,,,,,,,,,,,,,,,,,,,,,,,2.2.2,Coercion attempt & logging,,OK,,,,2025-12-05 17:23:55.024745+00:00,,,,,
,,Detect binary-like columns and flag semantics,,,,Binary catalog → binary_field_report.csv; feeds downstream numeric/categorical checks,,,,,,,,,,,,,,info,,,,,,,,,,,,,,8.0,6.0,,,,,,,22.0,,,,,,,,,,,,,,,,,,,,,,,,,,,,,,,,,,,,,,,,,,,,,,,,,,,,,,,,,,,,,,,,,,,,,,,,,,,,,,,,,,,,2.2.3,Binary field detection,,OK,,,,2025-12-05 17:23:55.181440+00:00,,,,,
,,Map SeniorCitizen 0/1 into human-readable + boolean flags,,,,seniorcitizen_flag_summary.csv; type map updated at column_type_map.json,,,,,,,,,,,,,,info,,,,,,,,,,,,,,,,,,,,,,,,,,,,,,,,,,,,,,,,,,,,,,,,,,,,,,,,,,,,,,,,,,0.0,7043.0,,,,,,,,,,,,,,,,,,,,7043.0,,,,,,,,,,,,,,,,,,,2.2.4,SeniorCitizen binary flag retype,,OK,,,,2025-12-05 17:23:55.302304+00:00,,,,,
,,"Ensure target flag exists, is 0/1, and matches raw label",,,,target_field_validation.csv; type map updated at column_type_map.json,,Int8,,,,,,,,,,,,info,,,,,,,,,,,,,,,,,,,,,,,,,,,,,,,,,,,,,,,,,,,,,,,,,,,,,,,,,,,0.0,,0.0,,,,,,,,,,,,,,,,,,,,,,,,,,7043.0,,,,,,,,,,,,,,,,,,Churn,2.2.5,Churn flag validation,,OK,Churn_flag,,,2025-12-05 17:23:55.414245+00:00,,,,,
,,Persist ID/protected contracts for downstream steps,,,,protected_columns.json; id_protected_registry.csv; type map updated at column_type_map.json,,,,,,,,,,,,,,info,,,,,,,,,,,,,,,,,,,,,,,,,,,,,,,,,,,,,,,3.0,,,,,,,,,,,,,,,,1.0,,,,,,,,,,,,,,,,,,,,,,,,,,,,3.0,,,,,,,,,,,,,,,,,,,,,,,2.2.6,ID & protected columns registration,,OK,,,,2025-12-05 17:23:55.507706+00:00,,,,,
,,Assign each column into numeric/categorical/binary/id/target groups,,,,feature_group_registry.csv; type map updated at column_type_map.json,,,,,,,,,,,,,,info,,,,,,,,,,,,,7.0,,,,,,,12.0,,24.0,,,,,,,,,,,,,,,,,,,,,,,,,,,,,,,,1.0,,,,,,,,,,,,,,,,4.0,,,,,,,,,,,,,,,,,,,,,,2.0,,,,,,,,,,,,,,2.2.7,Feature group classification,,OK,,,,2025-12-05 17:23:55.637657+00:00,,,,,
,,Plot distribution of column types and feature groups,,,,type_distribution_by_feature_group.png under /Users/b/DATA/PROJECTS/Telco/Level_3/resources/figures/section2,,,,,,,,,,,,,,info,,,,,,,,,,,,,,,,,,,,,,,,,,,,,,,,,,,,,,,,,,6.0,,,,,,,,,,,,,,,,,,,,,,,,,,,,,,,,,,,,,,,,,,,,,,,,,,,,,,,,,,,,,,,,2.2.8,Type summary visualization,,INFO,,,,2025-12-05 17:23:56.042673+00:00,,,,,
,,"Numeric dtype validity, nulls & non-finite values",,,,numeric_validation_report.csv,,,,,,,,,,,,,,info,,,,,,,,,,,,,,,,,,,,,,,,,,,,,,,,,,0.0,,,,,,,,,,,,,,,,,,,,,,,,,,,,,,,,,,,,,,5.0,,,,,,,,,,,,,,,,,,,,,,,,,4.0,1.0,,,,,,,,2.3.1,Base numeric validation,,OK,,,,2025-12-05 17:23:56.179989+00:00,,,,,
,,Apply min/max domain rules to numeric columns,,,,range_violation_report.csv,,,,,,,,,,,,,,info,,,,,,,,,,,,,,,,,,,,,,,,,,,,,,,,,,0.0,,,,,,,,,,,,,,,,,,,,,,,,,,,,,,,,,,,,,,,3.0,3.0,,,,,,,,,,,,,,,,,,,,,,,,0.0,,,,,,,,2.3.2,Range rule enforcement,,OK,,,,2025-12-05 17:23:56.275219+00:00,,,,,
,,Apply min/max domain rules to numeric columns,,,,range_violation_report.csv,,,,,,,,,,,,,,info,,,,,,,,,,,,,,,,,,,,,,,,,,,,,,,,,,0.0,,,,,,,,,,,,,,,,,,,,,,,,,,,,,,,,,,,,,,,0.0,0.0,,,,,,,,,,,,,,,,,,,,,,,,0.0,,,,,,,,2.3.2,Range rule enforcement,,OK,,,,2025-12-05 17:23:56.370516+00:00,,,,,
,,IQR and Z-score based outliers per numeric feature,,,,outlier_report_iqr_z.csv,,,,,,,,,,,,,,info,,,,16.215,,,,,,,,,,,,,,,,,,,,,,,,,,,,,,,,,,,,,,,,,,,,,,,,,1.0,,,,,,,,,,,,,,,,,5.0,,,,,,,,,,,,,,,,,,,,,,,,,,,,,,,,,,,,2.3.3,Outlier detection (IQR & Z),,WARN,,,,2025-12-05 17:23:56.465649+00:00,,,,,
,,"CV, MAD, entropy, zero/negative %, etc.",,,,numeric_metrics_enhanced.csv,,,,,,,,,,,,,,info,,,,,,,,,,,,,,,,,,,,,,,,,,,,,,,,,,,,,,,,,,,,,,,,,,,,2.0,,,,,,,,,,,,,,,,,,5.0,,,,,,,,,,,,,,,,,,,,,,,,,,,,,,2.0,,,,,,2.3.4,Enhanced numeric metrics,,WARN,,,,2025-12-05 17:23:56.696800+00:00,,,,,
,,Merge core numeric validation diagnostics into one table,,,,numeric_integrity_report.csv,,,,,,,,,,,,,,info,,,,,,,,,,,,,,,,,,,,,,,,,,,,,,,,,,0.0,,,,,,,,,,,,,,,,,,,,,,,,,,,,,,,,,,,,5.0,,,,3.0,,,,,,,,,,,,,,,,,,,,,,,,2.0,,,,,,,,2.3.5,Aggregated numeric report,,OK,,,,2025-12-05 17:23:56.871487+00:00,,,,,
,,Final per-column numeric snapshot,,,,numeric_profile_df.csv,,,,,,,,,,,,,,info,,,,,,,,,,,,,,,,,,,,,,,,,,,,,,,,,,0.0,,,,,,,,,,,,,,,,,,,,,,,,,,,,,,,,,,,,5.0,,,,,,,,,,,,,,,,,,,,,,,,,,,,,,,,,,,,2.3.6,Unified numeric profile,,OK,,,,2025-12-05 17:23:57.060109+00:00,,,,,
,,Bucketed temporal outliers per numeric feature,,,,time_series_outliers.csv under numeric,,,,,,,,,,,,,,info,,,,,,,,,,,,,,,,,,,,,,,,,,,,,,,,,,,,,,,,,,,,0.0,,,,,,,,,,,,,,,,,,,,,,,,,,,,,,,,,,,,,,,,,,,,,,,,,0.0,,,,,,,,,,,,,2.3.7.1,Time-series outliers,,SKIP,,M,as_of_date,2025-12-05 17:23:57.204168+00:00,,,,,
,,Identify periods with cross-metric temporal spikes,,,,global_temporal_anomalies.csv under numeric,,,,,,,,,,,,,,info,,,,,,,,0.0,,,,,,,,,,0.0,,,,,,,,,,,,,,,,,,,,,,,,,,,,,,,,,,,,,,,,,,,,,,,,,,,,,,,,,,,,,,,,,,,,,,,,,,,,,,,,,,,,,,,,2.3.7.2,Global temporal anomalies,,SKIP,,,,2025-12-05 17:23:57.266669+00:00,,,,,
,,Detect correlation drift vs baseline,,,0.3,correlation_anomalies.csv under numeric,,,,,,,,,,,,,,info,,,,,,,,,,,,,,,,,,,,,,,,,,,,,,,,,,,,,,,,,,,,,,,,,,,,,,,,,,,,,,,,,,,,,,,,,,,0.0,0.0,,,,,,,,,,,,,,,,,,,,,,,,,,,,,,2.3.7.3,Correlation-based anomalies,,SKIP,,,,2025-12-05 17:23:57.339252+00:00,,,,,3.0
,,Assign confidence & hardness to numeric rules,,,,rule_confidence_scores.csv under numeric,,,,,,,,,,,,,,info,,,,,,,,,,,,,,,,,,,,,,,,,,,,,,,,,,,,,,,,,,,,,,,,,0.0,,,,,,,,,,,,,,,,,,,,,,,,,,,,,,,,,,,,,,,0.0,,,0.0,,,,,,,,,,,,,,,2.3.7.4,Rule confidence scores,,SKIP,,,,2025-12-05 17:23:57.423855+00:00,,,,,
,,Per-feature readiness scores based on numeric quality,,,,model_readiness_report.csv,,,,,,,,,,,,,,info,,,,,,,,,,,,,,,,,,,,,,,,,,,,,,,,,,,,,,,,,,,0.0,,,,,,,,,,,,,,,,,,,0.0,,,,,,,,,,,,,,,,,,,,,,,,,,,,,,,,,,,,,,,,,,,,2.3.9,Model readiness impact summary,,SKIP,,,,2025-12-05 17:23:57.630455+00:00,,,,,
,,Severity-coded summary for dashboards/alerts,,,,dashboard_alerts.json,,,,,,,,,,,,,,info,,,,,,,,,,,,,,,,,,,,,,,,,,,,,,,,,,,,,,,,,,,0.0,,,,,,,,,,,,,,,,,,,,,,,,,,,,,,,,,,,,,,,,,0.0,,,,,,,,,,,,,,,0.0,,,,,,,2.3.10,Dashboard & alert integration,,OK,,,,2025-12-05 17:23:57.693865+00:00,,,,,
,,Lineage record for numeric integrity run,,,,numeric_audit_metadata.json,,,,,,,,,,,,,,info,,,,,,,,,,,,,,,,,,,,,,,,,,,,,,,,,,,,,,,,,,,,,,,,,,,,,,,,,,,,,,,,,,,,,,,,,,,,,,,,,,,,,,,,,,,,,,,,,,,,,,,,,,2.3.11,Numeric audit metadata,,OK,,,,2025-12-05 17:23:57.743631+00:00,,,,,
,,Optional scenario impact simulation,,,,forecast_sensitivity.csv,,,,,,,,,,,,,,info,,,,,,,,,,,,,,,,,,,,,,,,,,,,,,,,,,,,,,,,,,,,,,5.0,,,,,,,,,,,,,,,,,,,,,,,,,,,,,,,,,,,,,,,,,,,,,,,,,,,,,,,,,,,,2.3.12,Forecast sensitivity preview,,INFO,,,,2025-12-05 17:23:57.807864+00:00,,,,,
,,Relate numeric issues to target & fairness risk,,,,numeric_bias_risk_report.csv,,,,,,,,,,,,,,info,,,,,,,,,,,,,,,,,,,,,,,,,,,,,,,,,,,,,,,,,,,5.0,,,,,,,0.0,,,,,,,,,,,,,,,,,,,,,,,,,,,,,,,,,,,,,,,,,,,,,,,,,,,,,,,,2.3.13,Numeric explainability & bias diagnostics,,OK,,,,2025-12-05 17:23:57.961485+00:00,,,,,
,,Store contextual metadata per numeric anomaly (SHAP-ready),,,,anomaly_explainability_index.parquet,,,,,,,,,,,,,,info,,,,,,,0.0,,,,,,,,,,,,,,,,,,,,,,,,,,,,,,,,,,,,,,,,,,,,,,,,,,,,,,,,,,,,,,,,,,,,,,,,,,,,,,,,,,,,,,,,,,,,,,,,,,,2.3.14,Anomaly explainability index,,OK,,,,2025-12-05 17:23:58.093209+00:00,,,,,
,,Compare numeric distributions vs baseline & emit monitoring artifacts,,,,data_drift_metrics.csv; dashboard_updates.json,,,,,,,,,,,,,,info,,,,,0.0,,,,,,,,,,,,,,,,,,,,,,,,,,,,,,,,0.0,0.0,,,,,,,0.0,,,,,,,,,,,,,,,,,,,,,,,,,,,,,,,,,,,,,,,,,,,,,,,,,,,,,,,,,,,,,2.3.14,Data drift & monitoring hooks,,OK,,,,2025-12-05 17:23:58.185432+00:00,,,,,
,,Runtime & resource usage across Section 2 checks,,,,performance_profile.csv,,,,,,,,,,,,,,info,,,,,,,,,,,,,,,,,,,,,,,,,,,,,,,,,,,,,,,,,,,,,,,,,,,,,,,,,,,,,,,,,,,,,,,,,,,,,0.0,0.0,,,,,,,,,,,62.0,,,,,,,,,,,,,,,,,2.3.15,Cost & performance profiling (Section 2),,OK,,,,2025-12-05 17:23:58.295166+00:00,,,,0.0,
,,Evaluate configured data contracts against numeric artifacts,,,,data_contract_violations.json,,,,,,,,,,,,,,info,,,,,,,,,,,,,,,,,,,,,,,,,,,,,,,0.0,0.0,0.0,,,,,,,,,,,,,,,,,,,,,,,,,,,,,,,,,,,,,,,,,,,,,,,,,,,,,,,,,,,,,,,,,,,,,,,,,2.3.16,Data contracts & threshold enforcement,,OK,,,,2025-12-05 17:23:58.397706+00:00,,,,,
,,"Aggregate Section 2 statuses, drift, contracts, and performance into a single health view",0.0,,,run_health_summary.csv,0.0,,,,,,,,,,,,,info,,,,,,,,,,,,,,,,,,,,,,,,,,,,,,,,,,,,,,,,,,,,,,,,,,,,,,,,,,,,,,,,,,,,,,,,,,,,,,,,,,,,,,,,,109.0,0.0,,,,,,,,,,,OK,,,,,2.3.17,Run health summary dashboard,,WARN,,,,2025-12-05 17:23:58.498461+00:00,,,,0.0,
,,"Index all numeric/governance artifacts with existence, size, and timestamps",,,,numeric_artifact_manifest.csv,,,,,,,,,,,,,,info,,,,,,,,,,16.0,22.0,,,,,,,,,,,,,,,,,,,,,,,,,,,,,,,,,,,,,,,,,,,,,,,,,,,,,,,,,,,,,,,,,,,,,,,,,,,,,,,,,,,,,,,,,,,,,,,2.3.18,Numeric artifact manifest,,OK,,,,2025-12-05 17:23:58.576101+00:00,,,,,
,,Scan categorical columns for suspect placeholder / garbage tokens,,,,invalid_tokens.csv,,,,,,,,,,,,,,info,,,,,,,,,,,,,,,,,,,,,,,,,18.0,,0.0,,,,,,,,0.0,,,,,,,,,,,,,,,,,,,,,,,,,,,,,,,,,,,,,,,,,,,,,,,,,,,,,,,,,,,,,,,,,,,,,,,2.4.1,Invalid tokens scan,,OK,,,,2025-12-05 17:23:58.725871+00:00,,,,,
,,Compare observed values against configured valid domains,,,,unexpected_values.csv,,,,,,,,,,,,,,info,,,,,,,,,,,,,,,,,,,,,,,,,,17.0,,0.0,,,,,,,,,,,,,,,,,,,,,,,,,,,,,,,,,,,,,,,,,,,,,,,,,,,,,,,,,,,,,,,,,,,,0.0,,,,,,,,,,2.4.2,Unexpected categorical values,,OK,,,,2025-12-05 17:23:58.931562+00:00,,,,,
