apply_coercion,avg_readiness,check,contracts_hard_fail,dataset_version_id,delta_threshold,detail,drift_high_count,dtype_after_enforce,encoded_target,full_row_dupes,git_hash,has_full_dupes,imbalance_ratio,level,max_cardinality,max_null_pct,max_null_pct_col,max_outlier_pct,max_psi,n_actual,n_anomalies,n_anomalous_buckets,n_applied,n_artifacts_exist,n_artifacts_total,n_attempted,n_binary,n_binary_candidates,n_binary_features,n_binary_numeric,n_boolean,n_buckets,n_candidate_ids,n_categorical,n_cols,n_columns,n_columns_checked,n_columns_profiled,n_columns_scanned,n_columns_with_domains,n_columns_with_drift,n_columns_with_hygiene_issues,n_columns_with_invalid_tokens,n_columns_with_rare_categories,n_columns_with_unexpected_values,n_constant_cols,n_continuous,n_critical,n_critical_features,n_critical_issue_types,n_critical_token_columns,n_datetime,n_distinct_issue_pairs,n_dominant_domains,n_drift_high,n_drift_medium,n_excluded_from_model,n_expected,n_failed,n_feature_groups,n_features,n_features_checked,n_features_monitored,n_features_simulated,n_flags,n_fragmented_domains,n_hard_rules,n_high_bias_risk,n_high_card_cols,n_high_cardinality_columns,n_high_cv,n_high_drift_columns,n_high_outlier_cols,n_id,n_id_columns,n_id_configured,n_id_in_df,n_ids,n_inconsistent_rows,n_invalid_raw,n_invalid_target_vals,n_issue_files,n_low_entropy,n_low_readiness,n_mismatched,n_missing,n_near_constant,n_neg,n_non_01_values,n_non_null,n_non_unique,n_null_raw,n_numeric,n_numeric_checked,n_numeric_cols,n_numeric_with_rules,n_ok,n_pairs_anomalous,n_pairs_checked,n_pairs_involving_model_features,n_pairs_total,n_perf_critical,n_perf_warn,n_pos,n_preview_cols,n_preview_rows,n_protected,n_protected_columns,n_quasi_identifier_columns,n_rare_values_total,n_red,n_redundant_pairs,n_renamed_pairs,n_required,n_rows,n_rules,n_sections,n_sections_fail,n_soft_rules,n_strong_pairs,n_strong_target_pairs,n_target,n_time_outliers,n_unassigned,n_unexpected,n_unexpected_values_total,n_valid_ok,n_warn,n_yellow,n_zero_inflated,overall_contract_status,overall_null_pct,pct_invalid_raw,raw_target_col,raw_target_column,section,section_name,status,target_column,time_bucket,time_column,timestamp,top_missing_col,top_missing_pct,total_mem_mb,total_runtime_sec,window_size
,,Environment & config readiness preflight,,,,"Section 2 bootstrap complete: globals, directories, CONFIG roots, and working df are all ready.",,,,,,,,info,,,,,,,,,,,,,,,,,,,,,21.0,,,,,,,,,,,,,,,,,,,,,,,,,,,,,,,,,,,,,,,,,,,,,,,,,,,,,,,,,,,,,,,,,,,,,,,,,,,,,,,,7043.0,,,,,,,,,,,,,,,,,,,,,2.0.1,Environment & config readiness preflight,OK,,,,2025-11-20 14:07:18.738756,,,,,
,,Config & constants validation for Section 2,,,,All required config roots present and Section 2 constants registered.,,,,,,,,info,,,,,,,,,,,,,,,,,,,,,,,,,,,,,,,,,,,,,,,,,,,,,,,,,,,,,,,,,,,,,,,,,,,,,,,,0.0,,,,,,,,,,,,,,,,,,,,,,,,,,,,4.0,,,,,,,,,,,,,,,,,,,,,,2.0.2,Config & constants validation,OK,,,,2025-11-20 14:07:30.492938,,,,,
,,Section 2 run metadata snapshot,,1.0,,Metadata saved to section2_run_metadata.json,,,,,234fea7fe75632c511193cbfbde035d312c4b61e,,,info,,,,,,,,,,,,,,,,,,,,,,,,,,,,,,,,,,,,,,,,,,,,,,,,,,,,,,,,,,,,,,,,,,,,,,,,,,,,,,,,,,,,,,,,,,,,,,,,,,,,,,,,,,,,,,,,,,,,,,,,,,2.0.3,Logging & metadata setup,OK,,,,2025-11-20 14:09:51.499001,,,,,
,,Dataset-level shape & memory snapshot,,,,Snapshot of df at Section 2 start; overview written to section2_2_0_4_dataset_overview.csv,,,,,,,,info,,,,,,,,,,,,,,,,,,,,,21.0,,,,,,,,,,,,,,,,,,,,,,,,,,,,,,,,,,,,,,,,,,,,,,,,,,,,,,,,,,,,,,,,,,,,,,,,,,,,,,,,7043.0,,,,,,,,,,,,,,,,,,,,,2.0.4,Dataset snapshot & preview,OK,,,,2025-11-20 14:09:55.546810,,,6.5061,,
,,Environment & config readiness preflight,,,,"Section 2 bootstrap complete: globals, directories, CONFIG roots, and working df are all ready.",,,,,,,,info,,,,,,,,,,,,,,,,,,,,,21.0,,,,,,,,,,,,,,,,,,,,,,,,,,,,,,,,,,,,,,,,,,,,,,,,,,,,,,,,,,,,,,,,,,,,,,,,,,,,,,,,7043.0,,,,,,,,,,,,,,,,,,,,,2.0.1,Environment & config readiness preflight,OK,,,,2025-11-20 15:30:20.224800,,,,,
,,Config & constants validation for Section 2,,,,All required config roots present and Section 2 constants registered.,,,,,,,,info,,,,,,,,,,,,,,,,,,,,,,,,,,,,,,,,,,,,,,,,,,,,,,,,,,,,,,,,,,,,,,,,,,,,,,,,0.0,,,,,,,,,,,,,,,,,,,,,,,,,,,,4.0,,,,,,,,,,,,,,,,,,,,,,2.0.2,Config & constants validation,OK,,,,2025-11-20 15:30:20.310136,,,,,
,,Section 2 run metadata snapshot,,1.0,,Metadata saved to section2_run_metadata.json,,,,,234fea7fe75632c511193cbfbde035d312c4b61e,,,info,,,,,,,,,,,,,,,,,,,,,,,,,,,,,,,,,,,,,,,,,,,,,,,,,,,,,,,,,,,,,,,,,,,,,,,,,,,,,,,,,,,,,,,,,,,,,,,,,,,,,,,,,,,,,,,,,,,,,,,,,,2.0.3,Logging & metadata setup,OK,,,,2025-11-20 15:30:20.650398,,,,,
,,Dataset-level shape & memory snapshot,,,,Snapshot of df at Section 2 start; overview written to section2_2_0_4_dataset_overview.csv,,,,,,,,info,,,,,,,,,,,,,,,,,,,,,21.0,,,,,,,,,,,,,,,,,,,,,,,,,,,,,,,,,,,,,,,,,,,,,,,,,,,,,,,,,,,,,,,,,,,,,,,,,,,,,,,,7043.0,,,,,,,,,,,,,,,,,,,,,2.0.4,Dataset snapshot & preview,OK,,,,2025-11-20 15:30:20.853431,,,6.5061,,
,,"Overall missingness, dtype distribution, top-N missing columns",,,,Baseline summary written to section2_2_0_5_baseline_summary.csv; top missing column: TotalCharges (0.1562%).,,,,,,,,info,,,,,,,,,,,,,,,,,,,,,21.0,,,,,,,,,,,,,,,,,,,,,,,,,,,,,,,,,,,,,,,,,,,,,,,,,,,,,,,,,,,,,,,,,,,,,,,,,,,,,,,,7043.0,,,,,,,,,,,,,,,,,0.0074,,,,2.0.5,Row/Column baseline summary (lightweight),OK,,,,2025-11-20 15:30:20.910638,TotalCharges,0.1562,,,
,,Config-driven IDs and protected columns snapshot,,,,Protected columns snapshot written to protected_columns_2_0_6.yaml / protected_columns_2_0_6.json,,,,,,,,info,,,,,,,,,,,,,,,,,,,0.0,,,,,,,,,,,,,,,,,,,,,,,,,,,,,,,,,,,,,,,,,,,1.0,1.0,,,,,,,,,,,,,,,,,,,,,,,,,,,,,,3.0,,,,,,,,,,,,,,,,,,,,,,,,,,,,,2.0.6,ID & protected columns snapshot,OK,,,,2025-11-20 15:30:20.976275,,,,,
,,Dependency registry build,,,,Registered Section 2 nodes (2.0.x infra + 2.1–2.9 pipeline) into section2_registry.json.,,,,,,,,info,,,,,,,,,,,,,,,,,,,,,,,,,,,,,,,,,,,,,,,,,,,,,,,,,,,,,,,,,,,,,,,,,,,,,,,,,,,,,,,,,,,,,,,,,,,,,,,,,,,,,,,,,,,,,,,,,,,,,,,,,,2.0.7,Dependency registry build,OK,,,,2025-11-20 15:30:21.070717,,,,,
,,Sanity preview printout,,,,Printed Section 2 execution map and wrote section2_execution_map.md for documentation.,,,,,,,,info,,,,,,,,,,,,,,,,,,,,,,,,,,,,,,,,,,,,,,,,,,,,,,,,,,,,,,,,,,,,,,,,,,,,,,,,,,,,,,,,,,,,,,,,,,,,,,,,,,,,,,,,,,,,,,,,,,,,,,,,,,2.0.8,Sanity preview printout,OK,,,,2025-11-20 15:30:21.127295,,,,,
,,Create Churn_flag and validate raw target labels,,,,"Target 'Churn' normalized to 'Churn_flag' with 0 invalid labels; integrity report: target_integrity_report.csv, summary: churn_flag_summary.csv",,,Churn_flag,,,,0.3612,info,,,,,,,,,,,,,,,,,,,,,,,,,,,,,,,,,,,,,,,,,,,,,,,,,,,,,,,,,,,,,,,,,,0.0,,,,,,,,5174.0,,,,0.0,,,,,,,,,,,,1869.0,,,,,,,,,,,7043.0,,,,,,,,,,,,,,,,,,0.0,Churn,,2.1.1,Target variable creation & validation,OK,,,,2025-11-20 15:30:21.255151,,,,,
,,ID & key field verification,,,,ID integrity report written to id_integrity_report.csv; 0 non-unique or invalid ID columns.,,,,,,,,info,,,,,,,,,,,,,,,,,,,,,,,,,,,,,,,,,,,,,,,,,,,,,,,,,,,,,,,,,,,,,,,,1.0,,,,,,,,,,,,,0.0,,,,,,,,,,,,,,,,,,,,,,,,,,,,,,,,,,,,,,,,,,,,,2.1.2,ID & key field verification,OK,,,,2025-11-20 15:30:21.331523,,,,,
,,Special-case numeric flags,,,,Detected 1 special numeric flag column(s); written to special_numeric_flags.csv.,,,,,,,,info,,,,,,,,,,,,,,,,,,,,,,,,,,,,,,,,,,,,,,,,,,,,,,,,,,,1.0,,,,,,,,,,,,,,,,,,,,,,,,,,,,,,,,,,,,,,,,,,,,,,,,,,,,,,,,,,,,,,,,,,,,,,,2.1.3,Special-case numeric flag registration,OK,,,,2025-11-20 15:30:21.450643,,,,,
,,Duplicate audit,,,,Duplicate audit written to duplicate_audit_report.csv; 0 full-row duplicates detected.,,,,0.0,,,,info,,,,,,,,,,,,,,,,,,,,,,,,,,,,,,,,,,,,,,,,,,,,,,,,,,,,,,,,,,,,,,,,,,,,,,,,,,,,,,,,,,,,,,,,,,,,,,,,,,,,,,,,,,,,,,,,,,,,,,,,,,2.1.4,Duplicate & record-level consistency audit,OK,,,,2025-11-20 15:30:21.507581,,,,,
,,Duplicate audit preview,,,,Duplicate preview sample written to 2.1.4_duplicate_audit_sample.csv with 0 rows.,,,,,,0.0,,info,,,,,,,,,,,,,,,,,,,,,,,,,,,,,,,,,,,,,,,,,,,,,,,,,,,,,,,,,,,,,,,,,,,,,,,,,,,,,,,,,,,,,,,,,,,23.0,0.0,,,,,,,,,,,,,,,,,,,,,,,,,,,,,,2.1.4.5.5,Duplicate audit preview & sample export,OK,,,,2025-11-20 15:30:21.566354,,,,,
,,Schema-driven dtype enforcement and baseline capture,,,,Baseline: dtype_baseline_report.csv; Enforcement: dtype_enforcement_report.csv,,,,,,,,info,,,,,,,,,,,,,,,,,,,,,,,0.0,,,,,,,,,,,,,,,,,,,,,,,,,,,,,,,,,,,,,,,,,,,,,,,,0.0,,,,,,,,,,,,,,,,,,,,,,,,,,,,,,,,,,,,,,,,,,,,,,,,,,,2.1.5,Column-type enforcement & dtype baseline snapshot,SKIP,,,,2025-11-20 15:30:21.679003,,,,,
,,Compare df columns to EXPECTED_SCHEMA_COLUMNS / SCHEMA_EXPECTED_DTYPES,,,,Column comparison: schema_column_comparison.csv; Drift summary: schema_drift_report.csv,,,,,,,,info,,,,,,22.0,,,,,,,,,,,,,,,,,,,,,,,,,,,,,,,,,,,,,,0.0,,,,,,,,,,,,,,,,,,,,,,,,,,,,0.0,,,,,,,,,,,,,,,,,,,,,,,,,,,0.0,,,,,,,,,,,,22.0,,,,,,,,,,,2.1.6,Structural drift detection & expected schema comparison,SKIP,,,,2025-11-20 15:30:21.737945,,,,,
,,Feature roles & groups catalog,,,,Roles: feature_roles.csv; Groups YAML: feature_groups_2_1_7.yaml,,,,,,,,info,,,,,,,,,,,,,,,,,,,,,,22.0,,,,,,,,,,,,,,,,,,,,,,,,6.0,,,,,,,,,,,,,,,,,,,,,,,,,,,,,,,,,,,,,,,,,,,,,,,3.0,,,,,,,,,,,,,,,,,0.0,,,,,,,,,,,,2.1.7,Column role classification & feature group registration,OK,,,,2025-11-20 15:30:21.825969,,,,,
,,Column-level missingness baseline,,,,Missingness baseline: missingness_baseline.csv,,,,,,,,info,,0.1562,TotalCharges,,,,,,,,,,,,,,,,,,,,,,,,,,,,,,,,,,,,,,,,,,,,,,,,,,,,,,,,,,,,,,,,,,,,,,,,,,,,,,,,,,,,,,,,,,,,,,,,,,,,,,,,,,,,,,,,,,,0.0071,,,,2.1.8,Missingness baseline (pre-coercion),OK,,,,2025-11-20 15:30:21.961588,,,,,
,,Binary vs continuous numeric classification,,,,Audit written to binary_continuous_audit.csv,,,,,,,,info,,,,,,,,,,,,,,,,2.0,,,,,,,,,,,,,,,,,3.0,,,,,,,,,,,,,,,,,,,,,,,,,,,,,,,,,,,,,,,,,,,,,,,5.0,,,,,,,,,,,,,,,,,,,,,,,,,,,,,,,,,,,,,,,,,,2.1.9,Binary vs continuous feature audit,OK,,,,2025-11-20 15:30:22.032480,,,,,
,,Per-column cardinality overview,,,,Cardinality summary written to feature_cardinality_summary.csv,,,,,,,,info,7043.0,,,,,,,,,,,,,,,,,,,,,22.0,,,,,,,,,,0.0,,,,,,,,,,,,,,,,,,,,,,,2.0,,,,,,,,,,,,,,,,,,,,,,,,,,,,,,,,,,,,,,,,,,,,,,,,,,,,,,,,,,,,,,,,,,,2.1.10,Feature cardinality summary,OK,,,,2025-11-20 15:30:22.115032,,,,,
,,Merged schema consistency snapshot,,,,Schema consistency report written to schema_consistency_report.csv,,,,,,,,info,,,,,,,,,,,,,,,,,,,,,,22.0,,,,,,,,,,,,,,,,,,,,,,,,,,,,,,,,,,,,,,,,,,,,,,,,,,,,,,,,,,,,,,,,,,,,,,,,,,,,,,,,,,,,,,,,,,,,,,,,,,,,2.1.11,Structural summary report (Section 2.1),OK,,,,2025-11-20 15:30:22.311175,,,,,
,,Column type detection summary & type map artifact,,,,Type map → column_type_map.json; summary → type_detection_summary.csv,,,,,,,,info,,,,,,,,,,,,,,,,,5.0,,,12.0,,22.0,,,,,,,,,,,,,,,,0.0,,,,,,,,,,,,,,,,,,,,,,,,,,,,,,,,,,,,,,,,,5.0,,,,,,,,,,,,,,,,,,,,,,,,,,,,,,,,,,,,,,,,,,,2.2.1,Auto-detect data types,OK,,,,2025-11-20 23:30:22.918196+00:00,,,,,
0.0,,Coerce numeric/datetime-like strings with audit log,,,,Coercion log → coercion_log.csv; df mutated only when APPLY_COERCION=True & success is high,,,,,,,,info,,,,,,,,,0.0,,,0.0,,,,,,,,,,22.0,,,,,,,,,,,,,,,,,,,,,,,0.0,,,,,,,,,,,,,,,,,,,,,,,,,,,,,,,,,,,,,,,,,,,,,,,,,,,,,,,,,,,,,,,,,,,,,,,,,,,,,2.2.2,Coercion attempt & logging,OK,,,,2025-11-20 23:30:23.011944+00:00,,,,,
,,Detect binary-like columns and flag semantics,,,,Binary catalog → binary_field_report.csv; feeds downstream numeric/categorical checks,,,,,,,,info,,,,,,,,,,,,,,8.0,6.0,,,,,,,22.0,,,,,,,,,,,,,,,,,,,,,,,,,,,,,,,,,,,,,,,,,,,,,,,,,,,,,,,,,,,,,,,,,,,,,,,,,,,,,,,,,,,,,,,,,,,,,,,,,,,,2.2.3,Binary field detection,OK,,,,2025-11-20 23:30:23.205570+00:00,,,,,
,,Map SeniorCitizen 0/1 into human-readable + boolean flags,,,,seniorcitizen_flag_summary.csv; type map updated at column_type_map.json,,,,,,,,info,,,,,,,,,,,,,,,,,,,,,,,,,,,,,,,,,,,,,,,,,,,,,,,,,,,,,,,,,,,,,,,,,,,,,,,,,,,0.0,7043.0,,,,,,,,,,,,,,,,,,,,,,,,,7043.0,,,,,,,,,,,,,,,,,,,,,2.2.4,SeniorCitizen binary flag retype,OK,,,,2025-11-20 23:30:23.301160+00:00,,,,,
,,"Ensure target flag exists, is 0/1, and matches raw label",,,,target_field_validation.csv; type map updated at column_type_map.json,,Int8,,,,,,info,,,,,,,,,,,,,,,,,,,,,,,,,,,,,,,,,,,,,,,,,,,,,,,,,,,,,,,,,,,,,,,,,0.0,,0.0,,,,,,,,,,,,,,,,,,,,,,,,,,,,,,,,,,7043.0,,,,,,,,,,,,,,,,,,,,Churn,2.2.5,Churn flag validation,OK,Churn_flag,,,2025-11-20 23:30:23.373351+00:00,,,,,
,,Persist ID/protected contracts for downstream steps,,,,protected_columns.json; id_protected_registry.csv; type map updated at column_type_map.json,,,,,,,,info,,,,,,,,,,,,,,,,,,,,,,,,,,,,,,,,,,,,,,,,,,,3.0,,,,,,,,,,,,,,,,,,1.0,,,,,,,,,,,,,,,,,,,,,,,,,,,,,,,,,3.0,,,,,,,,,,,,,,,,,,,,,,,,,,,,2.2.6,ID & protected columns registration,OK,,,,2025-11-20 23:30:23.483721+00:00,,,,,
,,Assign each column into numeric/categorical/binary/id/target groups,,,,feature_group_registry.csv; type map updated at column_type_map.json,,,,,,,,info,,,,,,,,,,,,,7.0,,,,,,,12.0,,24.0,,,,,,,,,,,,,,,,,,,,,,,,,,,,,,,,,,,,,,1.0,,,,,,,,,,,,,,,,,,,4.0,,,,,,,,,,,,,,,,,,,,,,,,,,,,,2.0,,,,,,,,,,,,,,2.2.7,Feature group classification,OK,,,,2025-11-20 23:30:23.573953+00:00,,,,,
,,Plot distribution of column types and feature groups,,,,type_distribution_by_feature_group.png under /Users/b/DATA/PROJECTS/Telco/Level_3/resources/figures/section2,,,,,,,,info,,,,,,,,,,,,,,,,,,,,,,,,,,,,,,,,,,,,,,,,,,,,,,6.0,,,,,,,,,,,,,,,,,,,,,,,,,,,,,,,,,,,,,,,,,,,,,,,,,,,,,,,,,,,,,,,,,,,,,,,,,,,,2.2.8,Type summary visualization,INFO,,,,2025-11-20 23:30:30.384236+00:00,,,,,
,,"Numeric dtype validity, nulls & non-finite values",,,,numeric_validation_report.csv,,,,,,,,info,,,,,,,,,,,,,,,,,,,,,,,,,,,,,,,,,,0.0,,,,,,,,,,,,,,,,,,,,,,,,,,,,,,,,,,,,,,,,,,,,,,,5.0,,,,,,,,,,,,,,,,,,,,,,,,,,,,,,,,4.0,1.0,,,,,,,,2.3.1,Base numeric validation,OK,,,,2025-11-20 23:30:30.548156+00:00,,,,,
,,Apply min/max domain rules to numeric columns,,,,range_violation_report.csv,,,,,,,,info,,,,,,,,,,,,,,,,,,,,,,,,,,,,,,,,,,0.0,,,,,,,,,,,,,,,,,,,,,,,,,,,,,,,,,,,,,,,,,,,,,,,,3.0,3.0,,,,,,,,,,,,,,,,,,,,,,,,,,,,,,,0.0,,,,,,,,2.3.2,Range rule enforcement,OK,,,,2025-11-20 23:30:30.654968+00:00,,,,,
,,Apply min/max domain rules to numeric columns,,,,range_violation_report.csv,,,,,,,,info,,,,,,,,,,,,,,,,,,,,,,,,,,,,,,,,,,0.0,,,,,,,,,,,,,,,,,,,,,,,,,,,,,,,,,,,,,,,,,,,,,,,,0.0,0.0,,,,,,,,,,,,,,,,,,,,,,,,,,,,,,,0.0,,,,,,,,2.3.2,Range rule enforcement,OK,,,,2025-11-20 23:30:30.762406+00:00,,,,,
,,IQR and Z-score based outliers per numeric feature,,,,outlier_report_iqr_z.csv,,,,,,,,info,,,,16.215,,,,,,,,,,,,,,,,,,,,,,,,,,,,,,,,,,,,,,,,,,,,,,,,,,,,,,,1.0,,,,,,,,,,,,,,,,,,,,5.0,,,,,,,,,,,,,,,,,,,,,,,,,,,,,,,,,,,,,,,,,,,2.3.3,Outlier detection (IQR & Z),WARN,,,,2025-11-20 23:30:30.866598+00:00,,,,,
,,"CV, MAD, entropy, zero/negative %, etc.",,,,numeric_metrics_enhanced.csv,,,,,,,,info,,,,,,,,,,,,,,,,,,,,,,,,,,,,,,,,,,,,,,,,,,,,,,,,,,,,,,,,,2.0,,,,,,,,,,,,,,,,,,,,,,5.0,,,,,,,,,,,,,,,,,,,,,,,,,,,,,,,,,,,,,2.0,,,,,,2.3.4,Enhanced numeric metrics,WARN,,,,2025-11-20 23:30:30.969718+00:00,,,,,
,,Merge core numeric validation diagnostics into one table,,,,numeric_integrity_report.csv,,,,,,,,info,,,,,,,,,,,,,,,,,,,,,,,,,,,,,,,,,,0.0,,,,,,,,,,,,,,,,,,,,,,,,,,,,,,,,,,,,,,,,,,,,,5.0,,,,3.0,,,,,,,,,,,,,,,,,,,,,,,,,,,,,,,2.0,,,,,,,,2.3.5,Aggregated numeric report,OK,,,,2025-11-20 23:30:31.198648+00:00,,,,,
,,Final per-column numeric snapshot,,,,numeric_profile_df.csv,,,,,,,,info,,,,,,,,,,,,,,,,,,,,,,,,,,,,,,,,,,0.0,,,,,,,,,,,,,,,,,,,,,,,,,,,,,,,,,,,,,,,,,,,,,5.0,,,,,,,,,,,,,,,,,,,,,,,,,,,,,,,,,,,,,,,,,,,2.3.6,Unified numeric profile,OK,,,,2025-11-20 23:30:31.258551+00:00,,,,,
,,Bucketed temporal outliers per numeric feature,,,,time_series_outliers.csv under numeric,,,,,,,,info,,,,,,,,,,,,,,,,,,,,,,,,,,,,,,,,,,,,,,,,,,,,,,,,0.0,,,,,,,,,,,,,,,,,,,,,,,,,,,,,,,,,,,,,,,,,,,,,,,,,,,,,,,,,,,,,0.0,,,,,,,,,,,,,2.3.7.1,Time-series outliers,SKIP,,M,as_of_date,2025-11-20 23:30:31.375289+00:00,,,,,
,,Identify periods with cross-metric temporal spikes,,,,global_temporal_anomalies.csv under numeric,,,,,,,,info,,,,,,,,0.0,,,,,,,,,,0.0,,,,,,,,,,,,,,,,,,,,,,,,,,,,,,,,,,,,,,,,,,,,,,,,,,,,,,,,,,,,,,,,,,,,,,,,,,,,,,,,,,,,,,,,,,,,,,,,,,,,,,,,2.3.7.2,Global temporal anomalies,SKIP,,,,2025-11-20 23:30:31.418378+00:00,,,,,
,,Detect correlation drift vs baseline,,,0.3,correlation_anomalies.csv under numeric,,,,,,,,info,,,,,,,,,,,,,,,,,,,,,,,,,,,,,,,,,,,,,,,,,,,,,,,,,,,,,,,,,,,,,,,,,,,,,,,,,,,,,,,,,,,,0.0,0.0,,,,,,,,,,,,,,,,,,,,,,,,,,,,,,,,,,,,,2.3.7.3,Correlation-based anomalies,SKIP,,,,2025-11-20 23:30:31.460256+00:00,,,,,3.0
,,Assign confidence & hardness to numeric rules,,,,rule_confidence_scores.csv under numeric,,,,,,,,info,,,,,,,,,,,,,,,,,,,,,,,,,,,,,,,,,,,,,,,,,,,,,,,,,,,,,3.0,,,,,,,,,,,,,,,,,,,,,,,,,,,,,,,,,,,,,,,,,,,,,,,,,8.0,,,5.0,,,,,,,,,,,,,,,,,2.3.7.4,Rule confidence scores,OK,,,,2025-11-20 23:30:31.529237+00:00,,,,,
,0.9370806,Per-feature readiness scores based on numeric quality,,,,model_readiness_report.csv,,,,,,,,info,,,,,,,,,,,,,,,,,,,,,,,,,,,,,,,,,,,,,,,,,,,,,,,5.0,,,,,,,,,,,,,,,,,,,,,,,0.0,,,,,,,,,,,,,,,,,,,,,,,,,,,,,,,,,,,,,,,,,,,,,,,,,,,,2.3.8,Model readiness impact summary,OK,,,,2025-11-20 23:30:31.896166+00:00,,,,,
,,Severity-coded summary for dashboards/alerts,,,,dashboard_alerts.json,,,,,,,,info,,,,,,,,,,,,,,,,,,,,,,,,,,,,,,,,,,,,,,,,,,,,,,,5.0,,,,,,,,,,,,,,,,,,,,,,,,,,,,,,,,,,,,,,,,,,,,,,,,,,0.0,,,,,,,,,,,,,,,,,,2.0,,,,,,,2.3.9,Dashboard & alert integration,OK,,,,2025-11-20 23:30:31.965767+00:00,,,,,
,,Lineage record for numeric integrity run,,,,numeric_audit_metadata.json,,,,,,,,info,,,,,,,,,,,,,,,,,,,,,,,,,,,,,,,,,,,,,,,,,,,,,,,,,,,,,,,,,,,,,,,,,,,,,,,,,,,,,,,,,,,,,,,,,,,,,,,,,,,,,,,,,,,,,,,,,,,,,,,,,,2.3.10,Numeric audit metadata,OK,,,,2025-11-20 23:30:32.004534+00:00,,,,,
,,Optional scenario impact simulation,,,,forecast_sensitivity.csv,,,,,,,,info,,,,,,,,,,,,,,,,,,,,,,,,,,,,,,,,,,,,,,,,,,,,,,,,,,5.0,,,,,,,,,,,,,,,,,,,,,,,,,,,,,,,,,,,,,,,,,,,,,,,,,,,,,,,,,,,,,,,,,,,,,,,,2.3.11,Forecast sensitivity preview,INFO,,,,2025-11-20 23:30:32.613154+00:00,,,,,
,,Relate numeric issues to target & fairness risk,,,,numeric_bias_risk_report.csv,,,,,,,,info,,,,,,,,,,,,,,,,,,,,,,,,,,,,,,,,,,,,,,,,,,,,,,,5.0,,,,,,,0.0,,,,,,,,,,,,,,,,,,,,,,,,,,,,,,,,,,,,,,,,,,,,,,,,,,,,,,,,,,,,,,,,,,,,2.3.12,Numeric explainability & bias diagnostics,OK,,,,2025-11-20 23:30:32.767468+00:00,,,,,
,,Store contextual metadata per numeric anomaly (SHAP-ready),,,,anomaly_explainability_index.parquet,,,,,,,,info,,,,,,,1.0,,,,,,,,,,,,,,,,,,,,,,,,,,,,,,,,,,,,,,,,,,,,,,,,,,,,,,,,,,,,,,,,,,,,,,,,,,,,,,,,,,,,,,,,,,,,,,,,,,,,,,,,,,,,,,,,,,,2.3.13,Anomaly explainability index,OK,,,,2025-11-20 23:30:33.209129+00:00,,,,,
,,Compare numeric distributions vs baseline & emit monitoring artifacts,,,,data_drift_metrics.csv; dashboard_updates.json,,,,,,,,info,,,,,0.0,,,,,,,,,,,,,,,,,,,,,,,,,,,,,,,,,,,,0.0,0.0,,,,,,,5.0,,,,,,,,,,,,,,,,,,,,,,,,,,,,,,,,,,,,,,,,,,,,,,,,,,,,,,,,,,,,,,,,,,,,,,,,,2.3.14,Data drift & monitoring hooks,OK,,,,2025-11-20 23:30:33.382567+00:00,,,,,
,,Runtime & resource usage per numeric check,,,,performance_profile.csv,,,,,,,,info,,,,,,,,,,,,,,,,,,,,,,,,,,,,,,,,,,,,,,,,,,,,,,,,,,,,,,,,,,,,,,,,,,,,,,,,,,,,,,,,,,,,,,,,0.0,0.0,,,,,,,,,,,,,,18.0,,,,,,,,,,,,,,,,,,,2.3.15,Cost & performance profiling,OK,,,,2025-11-20 23:30:33.445768+00:00,,,,0.0,
,,"Aggregate Section 2 statuses, drift, contracts, and performance into a single health view",0.0,,,run_health_summary.csv,0.0,,,,,,,info,,,,,,,,,,,,,,,,,,,,,,,,,,,,,,,,,,,,,,,,,,,,,,,,,,,,,,,,,,,,,,,,,,,,,,,,,,,,,,,,,,,,,,,,,,,,,,,,,,,,,,,51.0,0.0,,,,,,,,,,,,,OK,,,,,2.3.17,Run health summary dashboard,WARN,,,,2025-11-20 23:33:37.249271+00:00,,,,0.0,
,,"Index all numeric/governance artifacts with existence, size, and timestamps",,,,numeric_artifact_manifest.csv,,,,,,,,info,,,,,,,,,,22.0,22.0,,,,,,,,,,,,,,,,,,,,,,,,,,,,,,,,,,,,,,,,,,,,,,,,,,,,,,,,,,,,,,,,,,,,,,,,,,,,,,,,,,,,,,,,,,,,,,,,,,,,,,,,,,,,,,,2.3.18,Numeric artifact manifest,OK,,,,2025-11-20 23:33:40.273487+00:00,,,,,
,,Scan categorical columns for suspect placeholder / garbage tokens,,,,invalid_tokens.csv,,,,,,,,info,,,,,,,,,,,,,,,,,,,,,,,,,18.0,,,,0.0,,,,,,,,0.0,,,,,,,,,,,,,,,,,,,,,,,,,,,,,,,,,,,,,,,,,,,,,,,,,,,,,,,,,,,,,,,,,,,,,,,,,,,,,,,,,,,,,2.4.1,Invalid tokens scan,OK,,,,2025-11-20 23:33:49.904241+00:00,,,,,
,,Compare observed values against configured valid domains,,,,unexpected_values.csv,,,,,,,,info,,,,,,,,,,,,,,,,,,,,,,,,,,0.0,,,,,0.0,,,,,,,,,,,,,,,,,,,,,,,,,,,,,,,,,,,,,,,,,,,,,,,,,,,,,,,,,,,,,,,,,,,,,,,,,,,,,,,,,0.0,,,,,,,,,,2.4.2,Unexpected categorical values,OK,,,,2025-11-20 23:33:52.488142+00:00,,,,,
,,Detect near-duplicate categories caused by encoding/case/whitespace,,,,hygiene_report.csv,,,,,,,,info,,,,,,,,,,,,,,,,,,,,,,,,,,,,0.0,,,,,,,,,,,0.0,,,,,,,,,,,,,,,,,,,,,,,,,,,,,,,,,,,,,,,,,,,,,,,,,,,,,,,,,,,,,,,,,,,,,,,,,,,,,,,,,,,2.4.3,Encoding / case / whitespace hygiene,OK,,,,2025-11-20 23:33:55.810365+00:00,,,,,
,,Summarize per-column domain shape and dominance,,,,domain_frequency_report.csv,,,,,,,,info,,,,,,,,,,,,,,,,,,,,,,,,18.0,,,,,,,,,,,,,,,,2.0,,,,,,,,,,,,1.0,,,,,,,,,,,,,,,,,,,,,,,,,,,,,,,,,,,,,,,,,,,,,,,,,,,,,,,,,,,,,,,,,,,,,,2.4.4,Domain frequency audit,OK,,,,2025-11-20 23:33:58.309026+00:00,,,,,
,,Identify high-cardinality / near-unique categorical features,,,,cardinality_audit.csv,,,,,,,,info,,,,,,,,,,,,,,,,,,,,,,,,,,,,,,,,,,,,,,,,,,,,,,,,,,,,,,,,1.0,,,,,,,,,,,,,,,,,,,,,,,,,,,,,,,,,,,,,,,0.0,,,,,,,,,,,,,,,,,,,,,,,,,,,2.4.5,Cardinality audit,WARN,,,,2025-11-20 23:34:08.071863+00:00,,,,,
,,Detect rare categorical levels and suggest grouping strategies,,,,rare_category_report.csv,,,,,,,,info,,,,,,,,,,,,,,,,,,,,,,,,,,,,,,1.0,,,,,,,,,,,,,,,,,,,,,,,,,,,,,,,,,,,,,,,,,,,,,,,,,,,,,,,,,,,,,,,,,,7043.0,,,,,,,,,,,,,,,,,,,,,,,,,,2.4.6,Rare-category audit,OK,,,,2025-11-20 23:34:13.046067+00:00,,,,,
,,Bundle all Part A outputs into a consolidated issues folder,,,,categorical_domain_issues_catalog/,,,,,,,,info,,,,,,,,,,,,,,,,,,,,,,,,,,,,,,,,,,,,0.0,,,,,,,,,,,,,,,,,,,,,,,,,,,,,,,,6.0,,,,,,,,,,,,,,,,,,,,,,,,,,,,,,,,,,,,,,,,,,,,,,,,,,,,,,2.4.7,Export categorical issues catalog,OK,,,,2025-11-20 23:34:15.845370+00:00,,,,,
,,Quantify categorical information content and dominance,,,,category_entropy_summary.csv,,,,,,,,info,,,,,,,,,,,,,,,,,,,,,,,,18.0,,,,,,,,,,,,,,,,,,,,,,,,,,,,,,,,,,,,,,,,,,,,,6.0,,,,0.0,,,,,,,,,,,,,,,,,,,,,,,,,,,,,,,,,,,,,,,,,,,,,,,,,2.4.8,Entropy & dominance analysis,OK,,,,2025-11-20 23:34:26.771695+00:00,,,,,
,,Compute Cramér’s V / Theil’s U between categorical pairs,,,,category_association_matrix.csv; association_heatmap.png,,,,,,,,info,,,,,,,,,,,,,,,,,,,,,,,,,,,,,,,,,,,,,,,,,,,,,,,,,,,,,,,,,,,,,,,,,,,,,,,,,,,,,,,,,,,,,,,153.0,,,,,,,,,,,,,,,,,,,39.0,0.0,,,,,,,,,,,,,,,2.4.9,Categorical association strengths,WARN,,,,2025-11-20 23:34:37.284827+00:00,,,,,
,,Highlight highly redundant categorical feature pairs,,,,category_redundancy_map.csv,,,,,,,,info,,,,,,,,,,,,,,,,,,,,,,,,,,,,,,,,,,,,,,,,,,,,,,,,,,,,,,,,,,,,,,,,,,,,,,,,,,,,,,,,,,,,,,0.0,,,,,,,,,,,,18.0,,,,,,,,,,,,,,,,,,,,,,,,2.4.10,Cross-categorical redundancy map,OK,,,,2025-11-20 23:34:37.381809+00:00,,,,,
,,Compare categorical distributions vs baseline snapshot,,,,category_drift_report.csv,,,,,,,,info,,,,,,,,,,,,,,,,,,,,,,,,,,,0.0,,,,,,,,,,,,,,,,,,,,,,,,,,,,,,,0.0,,,,,,,,,,,,,,,,,,,,,,,,,,,,,,,,,,,,,,,,,,,,,,,,,,,,,,,,,,,,,,,,2.4.11,Category drift vs baseline (optional),INFO,,,,2025-11-20 23:34:57.948669+00:00,,,,,
,,"Merge categorical audits, entropy, associations into one per-feature table",,,,categorical_profile_df.csv,,,,,,,,info,,,,,,,,,,,,,,,,,,,,,,,,,,,,,,,,,,,0.0,,,,,,,,,,,,18.0,,,,,,,,,,,,,,,,,,,,,,,,,,,,,,,,,,,,,,,,,,,,,,,,,,,,,,,,,,,,,,,,,,,,,,,,,,,2.4.12,Unified categorical quality profile,OK,,,,2025-11-20 23:35:03.273159+00:00,,,,,
